{
  "contentHash": "a3d1eb99f467d233565522390bb26552641c119a3b2af2ee1cebc4413f30e4cf",
  "generatedFrom": {
    "commit": "4baadbc6517070ae8f8feb2c97037adc2b305544",
    "derivedFrom": [
      "bd71ae420a63ee23a87f29ff8b734095ec5b4db3bf6b6d056b8d3e7c35740749",
      "8063a18b3e80e1514f422dcf94cfe087c96fb96c2558f531f3c5392636e4d097"
    ],
    "sources": [
      "surfaces.existing.json",
      "capabilities.existing.json"
    ],
    "workingTree": "clean"
  },
  "generator": {
    "name": "pmap",
    "version": "0.0.0"
  },
  "items": [
    {
      "capabilityId": "cap:package:helpers",
      "note": "Not referenced by any surface binding.",
      "relationship": "capability-unbound"
    },
    {
      "capabilityId": "cap:package:react",
      "note": "Not referenced by any surface binding.",
      "relationship": "capability-unbound"
    },
    {
      "capabilityId": "cap:command:shadcn.add",
      "note": "command module in packages/shadcn/src/commands",
      "relationship": "bound",
      "surfaceId": "surface:cli:shadcn"
    },
    {
      "capabilityId": "cap:command:shadcn.apply",
      "note": "command module in packages/shadcn/src/commands",
      "relationship": "bound",
      "surfaceId": "surface:cli:shadcn"
    },
    {
      "capabilityId": "cap:command:shadcn.build",
      "note": "command module in packages/shadcn/src/commands",
      "relationship": "bound",
      "surfaceId": "surface:cli:shadcn"
    },
    {
      "capabilityId": "cap:command:shadcn.diff",
      "note": "command module in packages/shadcn/src/commands",
      "relationship": "bound",
      "surfaceId": "surface:cli:shadcn"
    },
    {
      "capabilityId": "cap:command:shadcn.docs",
      "note": "command module in packages/shadcn/src/commands",
      "relationship": "bound",
      "surfaceId": "surface:cli:shadcn"
    },
    {
      "capabilityId": "cap:command:shadcn.eject",
      "note": "command module in packages/shadcn/src/commands",
      "relationship": "bound",
      "surfaceId": "surface:cli:shadcn"
    },
    {
      "capabilityId": "cap:command:shadcn.info",
      "note": "command module in packages/shadcn/src/commands",
      "relationship": "bound",
      "surfaceId": "surface:cli:shadcn"
    },
    {
      "capabilityId": "cap:command:shadcn.init",
      "note": "command module in packages/shadcn/src/commands",
      "relationship": "bound",
      "surfaceId": "surface:cli:shadcn"
    },
    {
      "capabilityId": "cap:command:shadcn.mcp",
      "note": "command module in packages/shadcn/src/commands",
      "relationship": "bound",
      "surfaceId": "surface:cli:shadcn"
    },
    {
      "capabilityId": "cap:command:shadcn.migrate",
      "note": "command module in packages/shadcn/src/commands",
      "relationship": "bound",
      "surfaceId": "surface:cli:shadcn"
    },
    {
      "capabilityId": "cap:command:shadcn.preset",
      "note": "command module in packages/shadcn/src/commands",
      "relationship": "bound",
      "surfaceId": "surface:cli:shadcn"
    },
    {
      "capabilityId": "cap:command:shadcn.search",
      "note": "command module in packages/shadcn/src/commands",
      "relationship": "bound",
      "surfaceId": "surface:cli:shadcn"
    },
    {
      "capabilityId": "cap:command:shadcn.view",
      "note": "command module in packages/shadcn/src/commands",
      "relationship": "bound",
      "surfaceId": "surface:cli:shadcn"
    },
    {
      "capabilityId": "cap:package:shadcn",
      "note": "bin declared by this package",
      "relationship": "bound",
      "surfaceId": "surface:cli:shadcn"
    },
    {
      "capabilityId": "cap:route:v4-api-search",
      "note": "route handler inside this app",
      "relationship": "bound",
      "surfaceId": "surface:dashboard:v4"
    },
    {
      "capabilityId": "cap:route:v4-init",
      "note": "route handler inside this app",
      "relationship": "bound",
      "surfaceId": "surface:dashboard:v4"
    },
    {
      "capabilityId": "cap:route:v4-init-md",
      "note": "route handler inside this app",
      "relationship": "bound",
      "surfaceId": "surface:dashboard:v4"
    },
    {
      "capabilityId": "cap:route:v4-init-v0",
      "note": "route handler inside this app",
      "relationship": "bound",
      "surfaceId": "surface:dashboard:v4"
    },
    {
      "capabilityId": "cap:route:v4-llm-slug-catchall",
      "note": "route handler inside this app",
      "relationship": "bound",
      "surfaceId": "surface:dashboard:v4"
    },
    {
      "capabilityId": "cap:route:v4-r-registries.json",
      "note": "route handler inside this app",
      "relationship": "bound",
      "surfaceId": "surface:dashboard:v4"
    },
    {
      "capabilityId": "cap:route:v4-rss.xml",
      "note": "route handler inside this app",
      "relationship": "bound",
      "surfaceId": "surface:dashboard:v4"
    },
    {
      "capabilityId": "cap:route:v4-typeset.css",
      "note": "route handler inside this app",
      "relationship": "bound",
      "surfaceId": "surface:dashboard:v4"
    },
    {
      "candidates": [
        {
          "id": "cap:command:shadcn.mcp",
          "reason": "token similarity (not a binding)",
          "score": 0.5
        }
      ],
      "note": "No declared capability bindings; candidates are proposals only.",
      "relationship": "surface-unbound",
      "surfaceId": "surface:mcp:shadcn"
    }
  ],
  "kind": "map",
  "schemaVersion": "product-map.v1",
  "scope": "shadcn-ui",
  "stance": "derived"
}
